<?xml version="1.0" encoding="UTF-8" ?>
<XMLDB PATH="mod/workshop/db" VERSION="20090831" COMMENT="XMLDB file for Moodle mod/workshop/grading/rubric"
    xmlns:xsi="http://www.w3.org/2001/XMLSchema-instance"
    xsi:noNamespaceSchemaLocation="../../../lib/xmldb/xmldb.xsd"
>
  <TABLES>
    <TABLE NAME="workshop_forms_rubric" COMMENT="The assessment dimensions definitions of Rubric grading strategy forms" PREVIOUS="workshop_forms_nograding" NEXT="workshop_forms_rubric_levels">
      <FIELDS>
        <FIELD NAME="id" TYPE="int" LENGTH="10" NOTNULL="true" UNSIGNED="true" SEQUENCE="true" NEXT="description"/>
        <FIELD NAME="description" TYPE="text" LENGTH="big" NOTNULL="false" SEQUENCE="false" COMMENT="The description of the dimension" PREVIOUS="id" NEXT="descriptionformat"/>
        <FIELD NAME="descriptionformat" TYPE="int" LENGTH="3" NOTNULL="false" UNSIGNED="true" DEFAULT="0" SEQUENCE="false" COMMENT="The format of the description field" PREVIOUS="description"/>
      </FIELDS>
      <KEYS>
        <KEY NAME="primary" TYPE="primary" FIELDS="id"/>
      </KEYS>
    </TABLE>
    <TABLE NAME="workshop_forms_rubric_levels" COMMENT="The definition of rubric rating scales" PREVIOUS="workshop_forms_rubric">
      <FIELDS>
        <FIELD NAME="id" TYPE="int" LENGTH="10" NOTNULL="true" UNSIGNED="true" SEQUENCE="true" NEXT="dimensionid"/>
        <FIELD NAME="dimensionid" TYPE="int" LENGTH="10" NOTNULL="true" UNSIGNED="true" SEQUENCE="false" COMMENT="Which criterion this level is part of" PREVIOUS="id" NEXT="grade"/>
        <FIELD NAME="grade" TYPE="int" LENGTH="10" NOTNULL="true" UNSIGNED="true" SEQUENCE="false" COMMENT="Grade representing this level." PREVIOUS="dimensionid" NEXT="description"/>
        <FIELD NAME="description" TYPE="text" LENGTH="big" NOTNULL="false" SEQUENCE="false" COMMENT="The definition of this level" PREVIOUS="grade" NEXT="descriptionformat"/>
        <FIELD NAME="descriptionformat" TYPE="int" LENGTH="3" NOTNULL="false" UNSIGNED="true" DEFAULT="0" SEQUENCE="false" COMMENT="The format of the description field" PREVIOUS="description"/>
      </FIELDS>
      <KEYS>
        <KEY NAME="primary" TYPE="primary" FIELDS="id" NEXT="dimension_fk"/>
        <KEY NAME="dimension_fk" TYPE="foreign" FIELDS="dimensionid" REFTABLE="workshop_forms_rubric" REFFIELDS="id" PREVIOUS="primary"/>
      </KEYS>
    </TABLE>
  </TABLES>
</XMLDB>
