<?xml version="1.0" encoding="UTF-8" ?>
<XMLDB PATH="question/type/match/db" VERSION="20130121" COMMENT="XMLDB file for Moodle question/type/match"
    xmlns:xsi="http://www.w3.org/2001/XMLSchema-instance"
    xsi:noNamespaceSchemaLocation="../../../../lib/xmldb/xmldb.xsd"
>
  <TABLES>
    <TABLE NAME="qtype_match_options" COMMENT="Defines the question-type specific options for matching questions" NEXT="qtype_match_subquestions">
      <FIELDS>
        <FIELD NAME="id" TYPE="int" LENGTH="10" NOTNULL="true" SEQUENCE="true" NEXT="questionid"/>
        <FIELD NAME="questionid" TYPE="int" LENGTH="10" NOTNULL="true" DEFAULT="0" SEQUENCE="false" COMMENT="Foreign key link to question.id." PREVIOUS="id" NEXT="shuffleanswers"/>
        <FIELD NAME="shuffleanswers" TYPE="int" LENGTH="4" NOTNULL="true" DEFAULT="1" SEQUENCE="false" PREVIOUS="questionid" NEXT="correctfeedback"/>
        <FIELD NAME="correctfeedback" TYPE="text" NOTNULL="true" SEQUENCE="false" COMMENT="Feedback shown for any correct response." PREVIOUS="shuffleanswers" NEXT="correctfeedbackformat"/>
        <FIELD NAME="correctfeedbackformat" TYPE="int" LENGTH="2" NOTNULL="true" DEFAULT="0" SEQUENCE="false" PREVIOUS="correctfeedback" NEXT="partiallycorrectfeedback"/>
        <FIELD NAME="partiallycorrectfeedback" TYPE="text" NOTNULL="true" SEQUENCE="false" COMMENT="Feedback shown for any partially correct response." PREVIOUS="correctfeedbackformat" NEXT="partiallycorrectfeedbackformat"/>
        <FIELD NAME="partiallycorrectfeedbackformat" TYPE="int" LENGTH="2" NOTNULL="true" DEFAULT="0" SEQUENCE="false" PREVIOUS="partiallycorrectfeedback" NEXT="incorrectfeedback"/>
        <FIELD NAME="incorrectfeedback" TYPE="text" NOTNULL="true" SEQUENCE="false" COMMENT="Feedback shown for any incorrect response." PREVIOUS="partiallycorrectfeedbackformat" NEXT="incorrectfeedbackformat"/>
        <FIELD NAME="incorrectfeedbackformat" TYPE="int" LENGTH="2" NOTNULL="true" DEFAULT="0" SEQUENCE="false" PREVIOUS="incorrectfeedback" NEXT="shownumcorrect"/>
        <FIELD NAME="shownumcorrect" TYPE="int" LENGTH="2" NOTNULL="true" DEFAULT="0" SEQUENCE="false" COMMENT="If true, then when the user gets the question partially correct, tell them how many choices they got correct alongside the feedback." PREVIOUS="incorrectfeedbackformat"/>
      </FIELDS>
      <KEYS>
        <KEY NAME="primary" TYPE="primary" FIELDS="id" NEXT="questionid"/>
        <KEY NAME="questionid" TYPE="foreign-unique" FIELDS="questionid" REFTABLE="question" REFFIELDS="id" PREVIOUS="primary"/>
      </KEYS>
    </TABLE>
    <TABLE NAME="qtype_match_subquestions" COMMENT="The subquestions that make up a matching question" PREVIOUS="qtype_match_options">
      <FIELDS>
        <FIELD NAME="id" TYPE="int" LENGTH="10" NOTNULL="true" SEQUENCE="true" NEXT="questionid"/>
        <FIELD NAME="questionid" TYPE="int" LENGTH="10" NOTNULL="true" DEFAULT="0" SEQUENCE="false" COMMENT="Foreign key link to question.id." PREVIOUS="id" NEXT="questiontext"/>
        <FIELD NAME="questiontext" TYPE="text" NOTNULL="true" SEQUENCE="false" PREVIOUS="questionid" NEXT="questiontextformat"/>
        <FIELD NAME="questiontextformat" TYPE="int" LENGTH="2" NOTNULL="true" DEFAULT="0" SEQUENCE="false" PREVIOUS="questiontext" NEXT="answertext"/>
        <FIELD NAME="answertext" TYPE="char" LENGTH="255" NOTNULL="true" SEQUENCE="false" PREVIOUS="questiontextformat"/>
      </FIELDS>
      <KEYS>
        <KEY NAME="primary" TYPE="primary" FIELDS="id" NEXT="questionid"/>
        <KEY NAME="questionid" TYPE="foreign" FIELDS="questionid" REFTABLE="question" REFFIELDS="id" PREVIOUS="primary"/>
      </KEYS>
    </TABLE>
  </TABLES>
</XMLDB>
