<?xml version="1.0" encoding="UTF-8" ?>
<XMLDB PATH="mod/quiz/report/statistics/db" VERSION="20080728" COMMENT="XMLDB file for Moodle mod/quiz/report/statistics"
    xmlns:xsi="http://www.w3.org/2001/XMLSchema-instance"
    xsi:noNamespaceSchemaLocation="../../../../../lib/xmldb/xmldb.xsd"
>
  <TABLES>
    <TABLE NAME="quiz_statistics" COMMENT="table to cache results from analysis done in statistics report for quizzes." NEXT="quiz_question_statistics">
      <FIELDS>
        <FIELD NAME="id" TYPE="int" LENGTH="10" NOTNULL="true" UNSIGNED="true" SEQUENCE="true" ENUM="false" NEXT="quizid"/>
        <FIELD NAME="quizid" TYPE="int" LENGTH="10" NOTNULL="true" UNSIGNED="true" SEQUENCE="false" ENUM="false" PREVIOUS="id" NEXT="groupid"/>
        <FIELD NAME="groupid" TYPE="int" LENGTH="10" NOTNULL="true" UNSIGNED="true" SEQUENCE="false" ENUM="false" PREVIOUS="quizid" NEXT="allattempts"/>
        <FIELD NAME="allattempts" TYPE="int" LENGTH="4" NOTNULL="true" UNSIGNED="true" SEQUENCE="false" ENUM="false" COMMENT="bool used to indicate whether these stats are for all attempts or just for the first." PREVIOUS="groupid" NEXT="timemodified"/>
        <FIELD NAME="timemodified" TYPE="int" LENGTH="10" NOTNULL="true" UNSIGNED="true" SEQUENCE="false" ENUM="false" PREVIOUS="allattempts" NEXT="firstattemptscount"/>
        <FIELD NAME="firstattemptscount" TYPE="int" LENGTH="10" NOTNULL="true" UNSIGNED="true" SEQUENCE="false" ENUM="false" PREVIOUS="timemodified" NEXT="allattemptscount"/>
        <FIELD NAME="allattemptscount" TYPE="int" LENGTH="10" NOTNULL="true" UNSIGNED="true" SEQUENCE="false" ENUM="false" PREVIOUS="firstattemptscount" NEXT="firstattemptsavg"/>
        <FIELD NAME="firstattemptsavg" TYPE="number" LENGTH="15" NOTNULL="false" UNSIGNED="true" SEQUENCE="false" ENUM="false" DECIMALS="5" PREVIOUS="allattemptscount" NEXT="allattemptsavg"/>
        <FIELD NAME="allattemptsavg" TYPE="number" LENGTH="15" NOTNULL="false" UNSIGNED="true" SEQUENCE="false" ENUM="false" DECIMALS="5" PREVIOUS="firstattemptsavg" NEXT="median"/>
        <FIELD NAME="median" TYPE="number" LENGTH="15" NOTNULL="false" UNSIGNED="true" SEQUENCE="false" ENUM="false" DECIMALS="5" PREVIOUS="allattemptsavg" NEXT="standarddeviation"/>
        <FIELD NAME="standarddeviation" TYPE="number" LENGTH="15" NOTNULL="false" UNSIGNED="true" SEQUENCE="false" ENUM="false" DECIMALS="5" PREVIOUS="median" NEXT="skewness"/>
        <FIELD NAME="skewness" TYPE="number" LENGTH="15" NOTNULL="false" UNSIGNED="false" SEQUENCE="false" ENUM="false" DECIMALS="10" PREVIOUS="standarddeviation" NEXT="kurtosis"/>
        <FIELD NAME="kurtosis" TYPE="number" LENGTH="15" NOTNULL="false" UNSIGNED="false" SEQUENCE="false" ENUM="false" DECIMALS="5" PREVIOUS="skewness" NEXT="cic"/>
        <FIELD NAME="cic" TYPE="number" LENGTH="15" NOTNULL="false" UNSIGNED="false" SEQUENCE="false" ENUM="false" DECIMALS="10" PREVIOUS="kurtosis" NEXT="errorratio"/>
        <FIELD NAME="errorratio" TYPE="number" LENGTH="15" NOTNULL="false" UNSIGNED="true" SEQUENCE="false" ENUM="false" DECIMALS="10" PREVIOUS="cic" NEXT="standarderror"/>
        <FIELD NAME="standarderror" TYPE="number" LENGTH="15" NOTNULL="false" UNSIGNED="true" SEQUENCE="false" ENUM="false" DECIMALS="10" PREVIOUS="errorratio"/>
      </FIELDS>
      <KEYS>
        <KEY NAME="primary" TYPE="primary" FIELDS="id"/>
      </KEYS>
    </TABLE>
    <TABLE NAME="quiz_question_statistics" COMMENT="Default comment for the table, please edit me" PREVIOUS="quiz_statistics">
      <FIELDS>
        <FIELD NAME="id" TYPE="int" LENGTH="10" NOTNULL="true" UNSIGNED="true" SEQUENCE="true" ENUM="false" NEXT="quizstatisticsid"/>
        <FIELD NAME="quizstatisticsid" TYPE="int" LENGTH="10" NOTNULL="true" UNSIGNED="true" SEQUENCE="false" ENUM="false" PREVIOUS="id" NEXT="questionid"/>
        <FIELD NAME="questionid" TYPE="int" LENGTH="10" NOTNULL="true" UNSIGNED="true" SEQUENCE="false" ENUM="false" PREVIOUS="quizstatisticsid" NEXT="subquestion"/>
        <FIELD NAME="subquestion" TYPE="int" LENGTH="4" NOTNULL="true" UNSIGNED="true" SEQUENCE="false" ENUM="false" PREVIOUS="questionid" NEXT="s"/>
        <FIELD NAME="s" TYPE="int" LENGTH="10" NOTNULL="true" UNSIGNED="true" DEFAULT="0" SEQUENCE="false" ENUM="false" PREVIOUS="subquestion" NEXT="effectiveweight"/>
        <FIELD NAME="effectiveweight" TYPE="number" LENGTH="15" NOTNULL="false" UNSIGNED="true" SEQUENCE="false" ENUM="false" DECIMALS="5" PREVIOUS="s" NEXT="discriminationindex"/>
        <FIELD NAME="discriminationindex" TYPE="number" LENGTH="15" NOTNULL="false" UNSIGNED="false" SEQUENCE="false" ENUM="false" DECIMALS="5" PREVIOUS="effectiveweight" NEXT="discriminativeefficiency"/>
        <FIELD NAME="discriminativeefficiency" TYPE="number" LENGTH="15" NOTNULL="false" UNSIGNED="false" SEQUENCE="false" ENUM="false" DECIMALS="5" PREVIOUS="discriminationindex" NEXT="sd"/>
        <FIELD NAME="sd" TYPE="number" LENGTH="15" NOTNULL="false" UNSIGNED="true" SEQUENCE="false" ENUM="false" DECIMALS="10" PREVIOUS="discriminativeefficiency" NEXT="facility"/>
        <FIELD NAME="facility" TYPE="number" LENGTH="15" NOTNULL="false" UNSIGNED="true" SEQUENCE="false" ENUM="false" DECIMALS="10" PREVIOUS="sd" NEXT="subquestions"/>
        <FIELD NAME="subquestions" TYPE="text" LENGTH="medium" NOTNULL="false" SEQUENCE="false" ENUM="false" PREVIOUS="facility" NEXT="maxgrade"/>
        <FIELD NAME="maxgrade" TYPE="int" LENGTH="10" NOTNULL="false" UNSIGNED="true" SEQUENCE="false" ENUM="false" PREVIOUS="subquestions" NEXT="positions"/>
        <FIELD NAME="positions" TYPE="text" LENGTH="medium" NOTNULL="false" SEQUENCE="false" ENUM="false" COMMENT="positions in which this item appears. Only used for random questions." PREVIOUS="maxgrade"/>
      </FIELDS>
      <KEYS>
        <KEY NAME="primary" TYPE="primary" FIELDS="id"/>
      </KEYS>
    </TABLE>
  </TABLES>
</XMLDB>