<?xml version="1.0" encoding="UTF-8" ?>
<XMLDB PATH="question/type/gapselect/db" VERSION="20080909" COMMENT="XMLDB file for Moodle question/type/gapselect"
    xmlns:xsi="http://www.w3.org/2001/XMLSchema-instance"
    xsi:noNamespaceSchemaLocation="../../../../lib/xmldb/xmldb.xsd"
>
  <TABLES>
    <TABLE NAME="question_gapselect" COMMENT="Defines select missing words questions">
      <FIELDS>
        <FIELD NAME="id" TYPE="int" LENGTH="10" NOTNULL="true" UNSIGNED="true" SEQUENCE="true" NEXT="questionid"/>
        <FIELD NAME="questionid" TYPE="int" LENGTH="10" NOTNULL="true" UNSIGNED="true" DEFAULT="0" SEQUENCE="false" PREVIOUS="id" NEXT="shuffleanswers"/>
        <FIELD NAME="shuffleanswers" TYPE="int" LENGTH="4" NOTNULL="true" UNSIGNED="true" DEFAULT="1" SEQUENCE="false" PREVIOUS="questionid" NEXT="correctfeedback"/>
        <FIELD NAME="correctfeedback" TYPE="text" LENGTH="small" NOTNULL="true" SEQUENCE="false" PREVIOUS="shuffleanswers" NEXT="partiallycorrectfeedback"/>
        <FIELD NAME="partiallycorrectfeedback" TYPE="text" LENGTH="small" NOTNULL="true" SEQUENCE="false" PREVIOUS="correctfeedback" NEXT="incorrectfeedback"/>
        <FIELD NAME="incorrectfeedback" TYPE="text" LENGTH="small" NOTNULL="true" SEQUENCE="false" PREVIOUS="partiallycorrectfeedback" NEXT="shownumcorrect"/>
        <FIELD NAME="shownumcorrect" TYPE="int" LENGTH="2" NOTNULL="true" UNSIGNED="true" DEFAULT="0" SEQUENCE="false" PREVIOUS="incorrectfeedback"/>
      </FIELDS>
      <KEYS>
        <KEY NAME="primary" TYPE="primary" FIELDS="id" NEXT="questionid"/>
        <KEY NAME="questionid" TYPE="foreign" FIELDS="questionid" REFTABLE="questions" REFFIELDS="id" PREVIOUS="primary"/>
      </KEYS>
    </TABLE>
  </TABLES>
</XMLDB>