<?xml version="1.0" encoding="UTF-8" ?>
<XMLDB PATH="mod/workshop/db" VERSION="20090831" COMMENT="XMLDB file for Moodle mod/workshop/grading/nograding"
    xmlns:xsi="http://www.w3.org/2001/XMLSchema-instance"
    xsi:noNamespaceSchemaLocation="../../../lib/xmldb/xmldb.xsd"
>
  <TABLES>
    <TABLE NAME="workshop_forms_nograding" COMMENT="The assessment dimensions definitions of No grading strategy forms">
      <FIELDS>
        <FIELD NAME="id" TYPE="int" LENGTH="10" NOTNULL="true" UNSIGNED="true" SEQUENCE="true" NEXT="description"/>
        <FIELD NAME="description" TYPE="text" LENGTH="big" NOTNULL="false" SEQUENCE="false" COMMENT="The description of the dimension" PREVIOUS="id" NEXT="descriptionformat"/>
        <FIELD NAME="descriptionformat" TYPE="int" LENGTH="3" NOTNULL="false" UNSIGNED="true" DEFAULT="0" SEQUENCE="false" COMMENT="The format of the description field" PREVIOUS="description"/>
      </FIELDS>
      <KEYS>
        <KEY NAME="primary" TYPE="primary" FIELDS="id"/>
      </KEYS>
    </TABLE>
  </TABLES>
</XMLDB>
