<?xml version="1.0" encoding="UTF-8" ?>
<XMLDB PATH="question/type/opaque/db" VERSION="20110114" COMMENT="XMLDB file for Moodle question/type/opaque"
    xmlns:xsi="http://www.w3.org/2001/XMLSchema-instance"
    xsi:noNamespaceSchemaLocation="../../../../lib/xmldb/xmldb.xsd"
>
  <TABLES>
    <TABLE NAME="question_opaque_engines" COMMENT="Remote engines that the Opaque question type can connect to. Each engine will comprise one or more servers stored in the question_opaque_servers table" NEXT="question_opaque_servers">
      <FIELDS>
        <FIELD NAME="id" TYPE="int" LENGTH="10" NOTNULL="true" UNSIGNED="false" SEQUENCE="true" COMMENT="id of the table, please edit me" NEXT="name"/>
        <FIELD NAME="name" TYPE="char" LENGTH="255" NOTNULL="true" SEQUENCE="false" COMMENT="The name used to identify this engine in the interface." PREVIOUS="id" NEXT="passkey"/>
        <FIELD NAME="passkey" TYPE="char" LENGTH="8" NOTNULL="false" SEQUENCE="false" COMMENT="The passkey for the QE if required." PREVIOUS="name"/>
      </FIELDS>
      <KEYS>
        <KEY NAME="primary" TYPE="primary" FIELDS="id" COMMENT="primary key of the table, please edit me"/>
      </KEYS>
    </TABLE>
    <TABLE NAME="question_opaque_servers" COMMENT="This table stores the individual servers that make up an Opaque remote engine." PREVIOUS="question_opaque_engines" NEXT="question_opaque">
      <FIELDS>
        <FIELD NAME="id" TYPE="int" LENGTH="10" NOTNULL="true" UNSIGNED="false" SEQUENCE="true" COMMENT="id of the table, please edit me" NEXT="engineid"/>
        <FIELD NAME="engineid" TYPE="int" LENGTH="10" NOTNULL="true" UNSIGNED="false" SEQUENCE="false" COMMENT="The Opaque engine this server is part of." PREVIOUS="id" NEXT="type"/>
        <FIELD NAME="type" TYPE="char" LENGTH="16" NOTNULL="true" SEQUENCE="false" COMMENT="The type of this server - question engine or question bank." PREVIOUS="engineid" NEXT="url"/>
        <FIELD NAME="url" TYPE="char" LENGTH="255" NOTNULL="true" SEQUENCE="false" COMMENT="The base URL of this server." PREVIOUS="type"/>
      </FIELDS>
      <KEYS>
        <KEY NAME="primary" TYPE="primary" FIELDS="id" COMMENT="primary key of the table, please edit me" NEXT="quesopaqserv_eng_fk"/>
        <KEY NAME="quesopaqserv_eng_fk" TYPE="foreign" FIELDS="engineid" REFTABLE="question_opaque_engines" REFFIELDS="id" PREVIOUS="primary"/>
      </KEYS>
    </TABLE>
    <TABLE NAME="question_opaque" COMMENT="Extra infomation required to define an Opaque question. This table extends the question table." PREVIOUS="question_opaque_servers">
      <FIELDS>
        <FIELD NAME="id" TYPE="int" LENGTH="10" NOTNULL="true" UNSIGNED="false" SEQUENCE="true" COMMENT="id of the table, please edit me" NEXT="questionid"/>
        <FIELD NAME="questionid" TYPE="int" LENGTH="10" NOTNULL="true" UNSIGNED="false" SEQUENCE="false" COMMENT="The id of the question this row relates to." PREVIOUS="id" NEXT="engineid"/>
        <FIELD NAME="engineid" TYPE="int" LENGTH="10" NOTNULL="true" UNSIGNED="false" SEQUENCE="false" COMMENT="The remote engine that provides this question. Refers to question_opaaque_engines.id." PREVIOUS="questionid" NEXT="remoteid"/>
        <FIELD NAME="remoteid" TYPE="char" LENGTH="255" NOTNULL="true" SEQUENCE="false" COMMENT="The id of this question - meaningful to the remote engine." PREVIOUS="engineid" NEXT="remoteversion"/>
        <FIELD NAME="remoteversion" TYPE="char" LENGTH="16" NOTNULL="true" SEQUENCE="false" COMMENT="The version of this question - meaningful to the remote engine." PREVIOUS="remoteid"/>
      </FIELDS>
      <KEYS>
        <KEY NAME="primary" TYPE="primary" FIELDS="id" COMMENT="primary key of the table, please edit me" NEXT="quesopaq_eng_fk"/>
        <KEY NAME="quesopaq_eng_fk" TYPE="foreign" FIELDS="engineid" REFTABLE="question_opaque_engines" REFFIELDS="id" PREVIOUS="primary" NEXT="quesopaq_que_fk"/>
        <KEY NAME="quesopaq_que_fk" TYPE="foreign" FIELDS="questionid" REFTABLE="question" REFFIELDS="id" PREVIOUS="quesopaq_eng_fk"/>
      </KEYS>
    </TABLE>
  </TABLES>
</XMLDB>
